{
  "project": "tg.ilia.ae",
  "commit": "a19ea76",
  "commitFull": "a19ea76825cda69c37e73241f2311b6ce18baa51",
  "branch": "main",
  "builtAt": "2026-04-30T19:52:44Z",
  "publishedAt": "2026-04-30T19:52:44Z",
  "bundles": [
    {
      "name": "main.js",
      "url": "https://tg.ilia.ae/main-BIAHWDLO.js",
      "sha256": "e863ec0b66f93d09b3a560914db384683ed5630651eae5f43dc9a09073cd331d",
      "size": 242594
    }
  ],
  "sourceRepoVisibility": "private"
}
