{
  "project": "tg.ilia.ae",
  "commit": "1443e7e",
  "commitFull": "1443e7e4849aa9068615cd2ecaacc67bab6ddeca",
  "branch": "main",
  "builtAt": "2026-04-30T19:31:13Z",
  "publishedAt": "2026-04-30T19:31:13Z",
  "bundles": [
    {
      "name": "main.js",
      "url": "https://tg.ilia.ae/main-ZNZW5REY.js",
      "sha256": "2faf4f4643ff72e7db59f56db7e6c1c69598f9f620c6658a8b1f7a6e3fe21ee1",
      "size": 7321
    }
  ],
  "sourceRepoVisibility": "private"
}
