{
  "project": "tg.ilia.ae",
  "commit": "0485fff",
  "commitFull": "0485fff271cc47a6d845072a5b919f2ee78b0344",
  "branch": "main",
  "builtAt": "2026-04-30T19:31:55Z",
  "publishedAt": "2026-04-30T19:31:55Z",
  "bundles": [
    {
      "name": "main.js",
      "url": "https://tg.ilia.ae/main-SZKBGFM7.js",
      "sha256": "be24d74ebc48ac3e36af641df783fcd791beda07df329f19d8090d679bc0978e",
      "size": 242824
    }
  ],
  "sourceRepoVisibility": "private"
}
